{
  "id": "prohairesis",
  "term": { "fr": "La prohairésis (faculté de choix)", "en": "Prohairesis (the faculty of choice)" },
  "aliases": { "fr": ["prohairésis", "prohairesis"], "en": ["prohairesis"] },
  "definition": {
    "fr": "La prohairésis est la faculté de choix et d'assentiment, ce par quoi nous jugeons, voulons et donnons ou refusons notre adhésion aux représentations. Pour <ph id='epictetus'>Épictète</ph>, elle est la seule chose entièrement en notre pouvoir, et donc le siège véritable de la liberté et de la personne. C'est le pôle « ce qui dépend de nous » de la <c id='dichotomy-of-control'>dichotomie du contrôle</c> : rien d'extérieur ne peut la contraindre sans notre propre consentement.",
    "en": "Prohairesis is the faculty of choice and assent, that by which we judge, will, and grant or withhold agreement to our impressions. For <ph id='epictetus'>Epictetus</ph> it is the one thing wholly within our power, and therefore the true seat of freedom and of the person. It is the \"up to us\" pole of the <c id='dichotomy-of-control'>dichotomy of control</c>: nothing external can compel it without our own consent."
  },
  "relatedAxes": ["FREEDOM", "CONTROL_SCOPE"],
  "relatedTerms": ["dichotomy-of-control"],
  "figure": { "slug": "epictetus", "name": { "fr": "Épictète", "en": "Epictetus" } },
  "positions": [
    { "axisId": "CONTROL_SCOPE", "poleId": "DICHOTOMY_OF_CONTROL" }
  ],
  "updatedAt": "2026-06-17T00:00:00.000Z"
}
