{
  "id": "world-soul",
  "term": { "fr": "l'Âme du monde", "en": "World-Soul" },
  "definition": {
    "fr": "L'Âme du monde est, chez <ph id='plotinus'>Plotin</ph>, la troisième <c id='hypostasis'>hypostase</c>, qui procède de l'<c id='nous'>Intellect</c> comme celui-ci procède de l'<c id='the-one'>Un</c>. Tournée vers le haut elle contemple l'intelligible, tournée vers le bas elle ordonne, anime et meut le monde sensible, dont elle est le principe de vie et d'unité. C'est par elle que le cosmos est un vivant ordonné, ultime reflet affaibli de la source dans le degré le plus bas de l'<c id='emanation'>émanation</c>.",
    "en": "The World-Soul is, in <ph id='plotinus'>Plotinus</ph>, the third <c id='hypostasis'>hypostasis</c>, which proceeds from <c id='nous'>Intellect</c> as Intellect proceeds from the <c id='the-one'>One</c>. Turned upward it contemplates the intelligible; turned downward it orders, animates, and moves the sensible world, of which it is the principle of life and unity. Through it the cosmos is an ordered living being, the last faint reflection of the source at the lowest degree of <c id='emanation'>emanation</c>."
  },
  "relatedAxes": ["REALITY_NATURE", "CAUSALITY"],
  "relatedTerms": ["the-one", "nous", "hypostasis", "emanation"],
  "figure": { "slug": "plotinus", "name": { "fr": "Plotin", "en": "Plotinus" } },
  "updatedAt": "2026-06-29T00:00:00.000Z"
}
