{
  "id": "amour-de-soi-et-amour-propre",
  "term": { "fr": "L'amour de soi et l'amour-propre", "en": "Self-love and amour-propre" },
  "aliases": { "fr": ["amour-propre"], "en": ["amour-propre"] },
  "definition": {
    "fr": "Distinction cardinale de <ph id='rousseau'>Rousseau</ph>. L'amour de soi est la passion naturelle et bonne par laquelle tout être veille à sa conservation et à son bien-être ; il est sans rapport à autrui et se tempère de <c id='pitie'>pitié</c>. L'amour-propre, lui, naît dans la société : c'est un sentiment relatif et factice qui pousse chacun à se comparer, à vouloir primer et à tirer son estime du regard des autres. De cette passion comparative naissent la vanité, l'envie, l'inégalité et la domination. Tout le mal moral vient ainsi non de la nature de l'homme, mais de cette dénaturation.",
    "en": "A cardinal distinction of <ph id='rousseau'>Rousseau</ph>. Self-love (amour de soi) is the natural and good passion by which every being attends to its preservation and well-being; it bears no relation to others and is tempered by <c id='pitie'>pity</c>. Amour-propre, by contrast, is born in society: a relative, factitious sentiment that drives each to compare himself, to want to come first and to draw his self-esteem from the regard of others. From this comparative passion arise vanity, envy, inequality and domination. All moral evil thus comes not from man's nature but from this denaturing."
  },
  "relatedAxes": ["SELF_INTEREST", "HUMAN_VISION", "DISTRIBUTIVE_JUSTICE"],
  "relatedTerms": ["pitie", "perfectibilite"],
  "figure": { "slug": "rousseau", "name": { "fr": "Jean-Jacques Rousseau", "en": "Jean-Jacques Rousseau" } },
  "positions": [
    { "axisId": "HUMAN_VISION", "poleId": "ANTHROPOLOGICAL_OPTIMISM" }
  ],
  "updatedAt": "2026-06-25T00:00:00.000Z"
}
